{
  "kind": "apm2.rfc.applier_output.v1",
  "base_revision_hash": "5eb033085a336db6a07279f4e8da163bce182139749fb47071f04a994089d2ea",
  "proposal_hash": "2f8a4c1e6d9b3f7a8e2c5d1f4b6a9c3e7f1d8b4a6c2e5f9a1d3b7c4e8f2a5d1b",
  "updated_document": "# RFC-0022 - Principal Sovereignty Interface (PSI)\n**Status:** DRAFT (2026-02-06)\n**Audience:** Security, daemon/runtime, governance, FAC, federation, audit, and formal methods reviewers\n**Scope:** Containment-tier protocol foundation for principal authority, stop-path integrity, autonomy graduation, and sovereign audit\n**Normative precedence:** `containment/security > verification/correctness > liveness/progress` (INV-F-14)\n**Dependency position:** Ships before RFC-0023, RFC-0024, RFC-0025, RFC-0026\n\n---\n\n## 0. Executive Summary (Non-Normative)\nAPM2 already has stop events, receipts, and fail-closed enforcement in RFC-0020. What it lacks is a complete sovereignty contract proving that the principal can always constrain, halt, audit, and revoke the autonomous holarchy at any scale.\n\nPSI adds that missing layer by defining:\n1. A formal sovereignty lattice where principal authority is mechanically top-ranked over all delegable authority.\n2. A physically independent stop path with cryptographic liveness proofs and automatic freeze on uncertainty.\n3. A four-level autonomy semilattice (`L0..L3`) with fail-safe regression and risk-tier capability ceilings.\n4. HTF-anchored temporal revocation and anti-replay semantics for sovereignty operations.\n5. Sovereign audit access with O(log n) proof complexity using existing receipt batching and Merkle multiproofs.\n6. External self-containment proof verified outside the autonomous system trust boundary.\n\nPSI preserves all RFC-0020 floors and strengthens them at the principal-control boundary.\n\n---\n\n## 0.1 Non-Negotiable Compatibility Floors (Normative)\nPSI MUST preserve or strengthen the RFC-0020 invariants:\n1. No ambient authority.\n2. Proof-carrying effects.\n3. Digest-first interfaces.\n4. Fail-closed enforcement.\n5. Canonicalization and bounded decoding.\n6. Strict delegation narrowing.\n7. Unitful typed quantities.\n8. Self-certifying identities with O(log n) verification.\n9. Freshness as policy, not best-effort.\n10. Batched attestations and ledger/quorum anchored roots.\n\nPSI-specific strengthening:\n1. Sovereignty authority MUST be verifiable without trusting autonomous software cooperation.\n2. Tier3+ authority-bearing sovereignty operations MUST require hardware-bound principal identity.\n3. Missing or stale sovereignty liveness evidence MUST trigger automatic freeze.\n4. Sovereignty constraints MUST be externally attestable as non-bypassable.\n\n---\n\n## 0.2 Rejected Design Options (Normative Rationale)\n1. **Software-only kill path:** Rejected. Violates PHY-05 and INV-F-14 under daemon compromise.\n2. **Quorum-only sovereignty root:** Rejected. Principal revocation/halt cannot depend on potentially Byzantine peer cooperation.\n3. **Eventual revocation semantics:** Rejected. Tier2+ actuation with uncertain revocation is forbidden by LAW-09, LAW-15, and security posture fail-closed rules.\n4. **Audit through autonomous projection APIs:** Rejected. Violates LAW-05 accountability axis and allows mediation attacks.\n\n---\n\n## 0.3 Constitutional Admissibility and Dominance Execution (Normative)\nPrincipal sovereignty is exercised over admissible actions only.\n\nConstitutional admissibility precheck:\n1. Any action violating mission-level humanitarian deny predicates is denied regardless of principal seal, quorum, or liveness pressure.\n2. Any action violating containment deny predicates is denied.\nGovernance evidence MUST expose separate booleans for humanitarian and containment precheck enforcement; these prechecks are not inferred from dominance ordering.\n\nDominance execution for admissible actions:\n1. Containment/security constraints.\n2. Verification/correctness constraints.\n3. Liveness/progress optimizations.\n\nTime authority execution rule:\n1. HTF artifacts are the only admissible time authority for sovereignty gate truth.\n2. Wall-clock fields are observational metadata only.\n3. Missing/stale/parse-invalid HTF artifacts are automatic deny outcomes.\n\nReference predicate:\n```bash\njq -e '.constitutional_admissibility_enforced == true and .humanitarian_precheck_enforced == true and .containment_precheck_enforced == true and .dominance_order == [\"containment_security\",\"verification_correctness\",\"liveness_progress\"] and .htf_time_authority_enforced == true and .wall_clock_used_for_gate_truth == false and .unknown_state_fail_closed == true' \\\n  evidence/rfcs/RFC-0022/governance/PSI-GOV-ORDER-001/summary.json\n```\n\n---\n\n## 1. Problem Statement and Objective Contracts (Normative)\n\n### 1.1 Deficit\nCurrent artifacts provide partial stop mechanics (`InterventionFreeze/InterventionUnfreeze`, stop-path SLOs, `MECH-EMERGENCY-STOP`) but do not define the principal-rooted sovereignty protocol for:\n1. Cryptographic root authority.\n2. Hardware-rooted principal identity.\n3. Graduated autonomy control.\n4. Tamper-evident stop-path liveness.\n5. Unmediated sovereign audit.\n6. External containment proof.\n\n### 1.2 Objective Contracts\nPSI adopts and tightens these machine-checkable objectives:\n\n| Objective | Predicate | Mandatory Outcome |\n|---|---|---|\n| OBJ-PSI-01 Hardware kill switch | `forall h in system: kill_switch_activation -> h.state=FROZEN within 2s` | Fail if any Tier3+ holon exceeds 2s p99 propagation |\n| OBJ-PSI-02 Halt-path liveness | `forall epoch: liveness_proof(halt_path) in epoch_seal OR system.state=FROZEN` | Missing proof is automatic freeze |\n| OBJ-PSI-03 Graduated autonomy | `forall action: action.risk_tier <= autonomy_level.max_risk_tier` | Deny and emit defect on exceedance |\n| OBJ-PSI-04 Sovereign audit | `forall action in ledger: audit_proof(action).verify=true AND proof_size=O(log n)` | Unprovable actions are non-authoritative |\n| OBJ-PSI-05 Hardware-rooted principal identity | `forall seal in T3+ ops: seal.key.attestation.hw_bound=true` | Software-only keys are invalid for T3+ |\n| OBJ-PSI-06 Self-containment proof | `exists verifier outside trust boundary: verify(containment_proof)=true` | Internal-only proof is non-compliant |\n\n### 1.3 Objective Contract Registry (Normative)\nEvery objective MUST bind baseline capture, target predicate, HTF boundary, owner locus, and evidence path.\n\n| Objective | Baseline Capture Ref | HTF Boundary | Owner / Decision Locus | Machine Predicate | Evidence Path |\n|---|---|---|---|---|---|\n| OBJ-PSI-01 | `PSI-BL-STOP-2026-02-06` | `HTF-BND-P1-SECURITY-CLOSE` | Security Council + Runtime Council | `jq -e '.stop_propagation_p99_ms <= 2000 and .deny_uncertainty_p99_ms <= 250 and .hardware_cut_independence == true and .kill_convergence_coverage == 1.0 and .unknown_state_count == 0 and .signature_valid == true' evidence/rfcs/RFC-0022/objectives/OBJ-PSI-01/summary.json` | `evidence/rfcs/RFC-0022/objectives/OBJ-PSI-01/` |\n| OBJ-PSI-02 | `PSI-BL-LIVENESS-2026-02-06` | `HTF-BND-P2-EARLY-CLOSE` | Security Council | `jq -e '.epoch_liveness_coverage == 1.0 and .missing_liveness_epoch_count == 0 and .false_pass_count == 0 and .unknown_state_count == 0' evidence/rfcs/RFC-0022/objectives/OBJ-PSI-02/summary.json` | `evidence/rfcs/RFC-0022/objectives/OBJ-PSI-02/` |\n| OBJ-PSI-03 | `PSI-BL-AUTONOMY-2026-02-06` | `HTF-BND-P2-CLOSE` | Governance Council + Verification Council | `jq -e '.action_over_ceiling_count == 0 and .epoch_cumulative_risk_overflow_count == 0 and .uncertainty_regression_correctness == 1.0 and .unknown_state_count == 0' evidence/rfcs/RFC-0022/objectives/OBJ-PSI-03/summary.json` | `evidence/rfcs/RFC-0022/objectives/OBJ-PSI-03/` |\n| OBJ-PSI-04 | `PSI-BL-AUDIT-2026-02-06` | `HTF-BND-P2-SEMANTICS-CLOSE` | Audit Council + Verification Council | `jq -e '.single_action_proof_complexity == \"O(log n)\" and .audit_completeness_failures == 0 and .omission_proof_coverage == 1.0 and .unknown_state_count == 0' evidence/rfcs/RFC-0022/objectives/OBJ-PSI-04/summary.json` | `evidence/rfcs/RFC-0022/objectives/OBJ-PSI-04/` |\n| OBJ-PSI-05 | `PSI-BL-HW-KEY-2026-02-06` | `HTF-BND-P2-CONTROL-CLOSE` | Security Council | `jq -e '.tier3plus_softkey_usage == 0 and .attestation_freshness_failures == 0 and .unknown_state_count == 0' evidence/rfcs/RFC-0022/objectives/OBJ-PSI-05/summary.json` | `evidence/rfcs/RFC-0022/objectives/OBJ-PSI-05/` |\n| OBJ-PSI-06 | `PSI-BL-CONTAINMENT-2026-02-06` | `HTF-BND-P3-CLOSE` | Security Council + External Assurance Lane | `jq -e '.external_verifier_coverage == 1.0 and .sovereignty_surface_coverage == 1.0 and .verifier_independence_pass == true and .internal_only_proof_count == 0 and .expired_proof_uses == 0 and .unknown_state_count == 0' evidence/rfcs/RFC-0022/objectives/OBJ-PSI-06/summary.json` | `evidence/rfcs/RFC-0022/objectives/OBJ-PSI-06/` |\n\nAll objective predicates fail closed on missing fields, parse errors, stale boundaries, invalid signatures, or unknown states.\n\n---\n\n## 2. System Model and Trust Boundaries (Normative)\n\n### 2.1 Components\n1. **Principal Control Stack (PCS):** Principal operator console, hardware token/HSM, physical kill actuator, out-of-band control network.\n2. **Sovereignty Kernel (SK):** Daemon subsystem that enforces sovereignty policy, autonomy checks, revocation, stop preconditions, and receipt bindings.\n3. **Halt Path Sentinel (HPS):** Independent verifier service validating stop-path liveness and latency.\n4. **Sovereign Audit Reader (SAR):** Read-only audit path into ledger/CAS with proof validation; bypasses autonomous projection layers.\n5. **Independent Containment Verifier (ICV):** External verifier checking non-bypass containment claims.\n\n### 2.2 Trust Boundaries\n1. **TB-0 Principal Root Boundary:** Principal identity and hardware root are trusted for sovereignty initiation.\n2. **TB-1 External Verifier Boundary:** HPS and ICV are trusted only for